{
   "Общие параметры": {
      " Тип ": "оперативная память",
      " Модель ": " Patriot Signature Line",
      " Код производителя ": " [PSD48G2666K]"
   },
   "Объем и состав комплекта": {
      " Тип памяти ": "DDR4",
      " Форм-фактор памяти ": "DIMM",
      " Суммарный объем памяти всего комплекта ": " 8 ГБ",
      " Объем одного модуля памяти ": " 4 ГБ",
      " Количество модулей в комплекте ": " 2",
      " Регистровая память ": " нет",
      " ECC-память ": " нет"
   },
   "Быстродействие": {
      " Тактовая частота ": " 2666 МГц",
      " Профили Intel XMP ": " нет"
   },
   "Тайминги": {
      " CAS Latency (CL) ": " 19",
      " RAS to CAS Delay (tRCD) ": " 19",
      " Row Precharge Delay (tRP) ": " 19",
      " Activate to Precharge Delay (tRAS) ": " 43"
   },
   "Конструкция": {
      " Наличие радиатора ": " нет",
      " Подсветка элементов платы ": " нет",
      " Высота ": " 31.25 мм",
      " Низкопрофильная (Low Profile) ": " нет"
   },
   "Дополнительно": {
      " Напряжение питания ": " 1.2 В"
   },
   "Описание": "Оперативная память Patriot Signature Line [PSD48G2666K] 8 ГБ предлагается вам в виде набора из пары планок типа DIMM DDR4, для каждой из которых характерен объем 4 ГБ. Если вам необходимо оснастить эффективным ОЗУ собираемый вами системный блок для домашней станции или рабочего ПК, такая память с пропускной способностью PC21300 и наибольшей тактовой частотой 2666 МГц станет эффективным решением. Они могут послужить и средством тюнинга для имеющегося компьютера, нуждающегося в повышении быстродействия.  Планки комплекта Patriot Signature Line [PSD48G2666K] 8 ГБ отличаются высотой 31.25 мм и поддерживают работу при входном напряжении 1.2 В. Изделия с расположением чипов памяти по обеим сторонам платы поставляются в блистерной упаковке.",
   "Цена": "4020 ₽"
}