{
   "Общие параметры": {
      " Тип ": "оперативная память",
      " Модель ": " Apacer",
      " Код производителя ": " [DL.08G2K.KAM]"
   },
   "Объем и состав комплекта": {
      " Тип памяти ": "DDR3",
      " Форм-фактор памяти ": "DIMM",
      " Суммарный объем памяти всего комплекта ": " 8 ГБ",
      " Объем одного модуля памяти ": " 8 ГБ",
      " Количество модулей в комплекте ": " 1",
      " Регистровая память ": " нет",
      " ECC-память ": " нет"
   },
   "Быстродействие": {
      " Тактовая частота ": " 1600 МГц",
      " Профили Intel XMP ": " нет"
   },
   "Тайминги": {
      " CAS Latency (CL) ": " 11",
      " RAS to CAS Delay (tRCD) ": " 11",
      " Row Precharge Delay (tRP) ": " 11"
   },
   "Конструкция": {
      " Наличие радиатора ": " нет",
      " Подсветка элементов платы ": " нет",
      " Высота ": " 30 мм",
      " Низкопрофильная (Low Profile) ": " нет"
   },
   "Дополнительно": {
      " Напряжение питания ": " 1.5 В"
   },
   "Описание": "Поставить оперативную память Apacer [AU08GFA60CATBGC] 8 ГБ предлагается в различные компьютеры. Изготовлена она из проверенных компонентов, тщательно соблюдаются требования к качеству на заводе производителя.  Модуль Apacer [AU08GFA60CATBGC] 8 ГБ выпущен в форм-факторе DIMM. Следовательно, планка используется в стационарных системах. Обязательно учитывайте тип памяти – DDR3. Проверяйте совместимость этого модуля с материнской платой и иными компонентами компьютера. Процесс его подключения крайне прост, достаточно поставить планку в специальный слот.  Объем памяти – 8 ГБ. Ее рабочая частота – 1600 МГц. Эта планка отличается прекрасной пропускной способностью. Она оперативно обменивается данными с другими элементами системы, обеспечивается высокое быстродействие компьютера.  Напряжение подаваемого питания – 1.5 В. Модуль имеет высоту 30 мм, а тайминги у него 11-11-11. Планка рекомендована для применения в офисных и домашних сборках, она идеально впишется в систему.",
   "Цена": "5665 ₽"
}