{
   "Общие параметры": {
      " Тип ": "оперативная память",
      " Модель ": " AMD Radeon R7 Performance Series",
      " Код производителя ": " [R748G2400U2S-U]"
   },
   "Объем и состав комплекта": {
      " Тип памяти ": "DDR4",
      " Форм-фактор памяти ": "DIMM",
      " Суммарный объем памяти всего комплекта ": " 8 ГБ",
      " Объем одного модуля памяти ": " 8 ГБ",
      " Количество модулей в комплекте ": " 1",
      " Регистровая память ": " нет",
      " ECC-память ": " нет"
   },
   "Быстродействие": {
      " Тактовая частота ": " 2400 МГц"
   },
   "Тайминги": {
      " CAS Latency (CL) ": " 16",
      " RAS to CAS Delay (tRCD) ": " 16",
      " Row Precharge Delay (tRP) ": " 16"
   },
   "Конструкция": {
      " Наличие радиатора ": " нет",
      " Подсветка элементов платы ": " нет",
      " Высота ": " 31.25 мм",
      " Низкопрофильная (Low Profile) ": " нет"
   },
   "Дополнительно": {
      " Напряжение питания ": " 1.2 В"
   },
   "Описание": "Оперативная память AMD Radeon R7 Performance Series [R748G2400U2S-U] - модуль ОЗУ, который обеспечит быстродействие и производительность компьютерной системы. Представленную модель можно использовать как для сборки компьютера с нуля, так и для апгрейда уже готового системного блока. Функциональные возможности и параметры этого устройства делают его оптимальным решением не только для обычных пользователей, но и для профессиональных дизайнеров и для геймеров. Частота, равная 2400 МГц, обеспечивает плавную и бесперебойную работу всех запущенных процессов.  Оперативная память AMD Radeon R7 Performance Series [R748G2400U2S-U] относится к форм-фактору UDIMM, обеспечивающему контроль и стабилизацию пропуска информации сквозь имеющиеся каналы. Объем представленной модели соответствует 8 ГБ. Низкое энергопотребление модуля памяти обеспечено типом DDR4, благодаря чему его можно использовать в высокопроизводительных компьютерных системах. Пропускная способность представленной модели - PC19200.",
   "Цена": "3712 ₽"
}