{
   "Общие параметры": {
      " Тип ": "оперативная память",
      " Модель ": " Patriot Signature",
      " Код производителя ": " [PSD22G80026]"
   },
   "Объем и состав комплекта": {
      " Тип памяти ": "DDR2",
      " Форм-фактор памяти ": "DIMM",
      " Суммарный объем памяти всего комплекта ": " 2 ГБ",
      " Объем одного модуля памяти ": " 2 ГБ",
      " Количество модулей в комплекте ": " 1",
      " Регистровая память ": " нет",
      " ECC-память ": " нет"
   },
   "Быстродействие": {
      " Тактовая частота ": " 800 МГц",
      " Профили Intel XMP ": " нет"
   },
   "Тайминги": {
      " CAS Latency (CL) ": " 6",
      " RAS to CAS Delay (tRCD) ": " 6",
      " Row Precharge Delay (tRP) ": " 6",
      " Activate to Precharge Delay (tRAS) ": " 18"
   },
   "Конструкция": {
      " Наличие радиатора ": " нет",
      " Подсветка элементов платы ": " нет",
      " Высота ": " 31 мм",
      " Низкопрофильная (Low Profile) ": " нет"
   },
   "Дополнительно": {
      " Напряжение питания ": " 1.8 В"
   },
   "Описание": "2-гигабайтная оперативная память Patriot Signature [PSD22G80026] применяется в офисных рабочих станциях и домашних компьютерах, использующих память, относящуюся к типу DDR2. Модуль памяти отличается высокой степенью надежности, и может использоваться в системах, работающих с нагрузкой выше средней. Устройство подойдет для использования как в качестве единственного модуля памяти, так и для применения в комбинации с аналогичными модулями.  Модуль памяти Patriot Signature [PSD22G80026] использует тактовую частоту 800 МГц. Устройство может работать на частотах 400 МГц, 533 МГц, 667 МГц, 800 МГц. Пропускная способность модуля памяти равна 6400 МБ/с. Модель соответствует таймингам 6-6-6-18.  Для питания модуля памяти используется напряжение 1.8 В. Высота устройства равна 31 мм. Модуль памяти поставляется в компактной упаковке, конструктивное исполнение которой позволяет ознакомиться с внешним видом устройства. В наличии наклейка, на которой содержится информация об основных технических характеристиках памяти.",
   "Цена": "3622 ₽"
}