{
   "Общие параметры": {
      " Тип ": "оперативная память",
      " Модель ": " Patriot Signature Line Premium",
      " Код производителя ": " [PSP48G266681H1]"
   },
   "Объем и состав комплекта": {
      " Тип памяти ": "DDR4",
      " Форм-фактор памяти ": "DIMM",
      " Суммарный объем памяти всего комплекта ": " 8 ГБ",
      " Объем одного модуля памяти ": " 8 ГБ",
      " Количество модулей в комплекте ": " 1",
      " Регистровая память ": " нет",
      " ECC-память ": " нет",
      " Ранговость ": " одноранговая"
   },
   "Быстродействие": {
      " Тактовая частота ": " 2666 МГц",
      " Профили Intel XMP ": " нет"
   },
   "Тайминги": {
      " CAS Latency (CL) ": " 19",
      " RAS to CAS Delay (tRCD) ": " 19",
      " Row Precharge Delay (tRP) ": " 19",
      " Activate to Precharge Delay (tRAS) ": " 43"
   },
   "Конструкция": {
      " Наличие радиатора ": " есть",
      " Подсветка элементов платы ": " нет",
      " Высота ": " 37 мм",
      " Низкопрофильная (Low Profile) ": " нет"
   },
   "Дополнительно": {
      " Напряжение питания ": " 1.2 В"
   },
   "Описание": "Оперативная память Patriot Signature Line Premium [PSP48G266681H1] имеет емкость 8 ГБ, отличается высокой производительностью, за счет чего поможет поднять быстродействие вашего компьютера. Благодаря своим возможностям, а также строгому дизайну данная модель станет отличным выбором для игровых систем и рабочих станций.  Оперативная память Patriot Signature Line Premium [PSP48G266681H1] выполнена в формате DIMM и соответствует стандарту DDR4. Благодаря этому рабочая частота модели может достигать 2666 МГц, что вкупе с пропускной способностью PC21300 и таймингами, соответствующими 19-19-19-43, обеспечивает высокое быстродействие компьютера в различных задачах — при работе с большими массивами данных, в требовательных играх или профессиональной работе с фото и видео высокого разрешения.  Отличительной особенностью оперативной памяти Patriot Signature Line Premium [PSP48G266681H1] является наличие радиатор пассивного охлаждения, благодаря которому предотвращается перегрев при продолжительной работе. Высота корпуса модуля не превышает 37 мм. Напряжение питания составляет 1.2 В. Оперативная память поставляется поштучно.",
   "Цена": "5384 ₽"
}