{
   "Общие параметры": {
      " Тип ": "оперативная память",
      " Модель ": " QUMO",
      " Код производителя ": " [QUM3U-8G1600C11]"
   },
   "Объем и состав комплекта": {
      " Тип памяти ": "DDR3",
      " Форм-фактор памяти ": "DIMM",
      " Суммарный объем памяти всего комплекта ": " 8 ГБ",
      " Объем одного модуля памяти ": " 8 ГБ",
      " Количество модулей в комплекте ": " 1",
      " Регистровая память ": " нет",
      " ECC-память ": " нет"
   },
   "Быстродействие": {
      " Тактовая частота ": " 1600 МГц",
      " Профили Intel XMP ": " нет"
   },
   "Тайминги": {
      " CAS Latency (CL) ": " 11",
      " RAS to CAS Delay (tRCD) ": " 11",
      " Row Precharge Delay (tRP) ": " 11",
      " Activate to Precharge Delay (tRAS) ": " 28"
   },
   "Конструкция": {
      " Наличие радиатора ": " нет",
      " Подсветка элементов платы ": " нет",
      " Высота ": " 30 мм",
      " Низкопрофильная (Low Profile) ": " нет"
   },
   "Дополнительно": {
      " Напряжение питания ": " 1.5 В"
   },
   "Описание": "Оперативная память Qumo [QUM3U-8G1600C11] 8 ГБ относится к типу DDR3 и форм-фактору DIMM, являясь модулем ОЗУ для установки в системный блок ПК. Ее можно подключить к компьютерной системе, материнская плата которой поддерживает такой тип памяти. Этот модуль ОЗУ имеет объем 8 ГБ и может применяться в качестве единственной планки оперативной памяти системы, гарантируя ей высокое быстродействие и стабильную одновременную работу нескольких приложений.  Оперативная память Qumo [QUM3U-8G1600C11] 8 ГБ имеет пропускную способность до 12800 МБ в секунду и поддерживает работу с тактовой частотой 800, 1066, 1333 или 1600 МГц. Имея высоту 30 мм, модуль нуждается для нормальной работы в питании с напряжением 1.5 В. Он предлагается вам в прозрачном пластиковом футляре, предохраняющем его от загрязнений и негативных воздействий.",
   "Цена": "5028 ₽"
}