{
   "Общие параметры": {
      " Тип ": "оперативная память",
      " Модель ": " Silicon Power [SP004GBLTU160N02]"
   },
   "Объем и состав комплекта": {
      " Тип памяти ": "DDR3",
      " Форм-фактор памяти ": "DIMM",
      " Суммарный объем памяти всего комплекта ": " 4 ГБ",
      " Объем одного модуля памяти ": " 4 ГБ",
      " Количество модулей в комплекте ": " 1",
      " Регистровая память ": " нет",
      " ECC-память ": " нет"
   },
   "Быстродействие": {
      " Тактовая частота ": " 1600 МГц",
      " Профили Intel XMP ": " нет"
   },
   "Тайминги": {
      " CAS Latency (CL) ": " 11",
      " RAS to CAS Delay (tRCD) ": " 11",
      " Row Precharge Delay (tRP) ": " 11",
      " Activate to Precharge Delay (tRAS) ": " 30"
   },
   "Конструкция": {
      " Наличие радиатора ": " нет",
      " Подсветка элементов платы ": " нет",
      " Высота ": " 30 мм",
      " Низкопрофильная (Low Profile) ": " нет"
   },
   "Дополнительно": {
      " Напряжение питания ": " 1.5 В"
   },
   "Описание": "Оперативная память Silicon Power [SP004GBLTU160N02] – незаменимая часть компьютерного устройства, обеспечивающая высокую скорость работы с различными приложениями и программами. Компактные размеры, в частности высота 30 мм, характерны для DIMM и дают возможность в несколько раз расширить объем временной памяти компьютера путем размещения в одной материнской плате нескольких модулей. Особенно актуально это среди геймеров и компьютерных разработчиков. Тип памяти – DDR3, который является продуктивным и быстрым. Объем 4 ГБ позволяет работать с тяжелыми приложениями и играми. Единственный модуль обладает 16 чипами, запаянными с одной стороны модуля.  Тактовая частота оперативной памяти Silicon Power [SP004GBLTU160N02] составляет 1600 МГц. 12800 МБ/с – объем передачи и получения данных от жесткого диска. Тайминги с показателями 11-11-11-30 отвечают за скорость запуска компьютерной программы. Бесперебойная работа \"оперативки\" осуществляется при постоянном напряжении 1.5 В.",
   "Цена": "4327 ₽"
}