{
   "Общие параметры": {
      " Тип ": "оперативная память",
      " Модель ": " Patriot Signature",
      " Код производителя ": " [PSD34G16002]"
   },
   "Объем и состав комплекта": {
      " Тип памяти ": "DDR3",
      " Форм-фактор памяти ": "DIMM",
      " Суммарный объем памяти всего комплекта ": " 4 ГБ",
      " Объем одного модуля памяти ": " 4 ГБ",
      " Количество модулей в комплекте ": " 1",
      " Регистровая память ": " нет",
      " ECC-память ": " нет"
   },
   "Быстродействие": {
      " Тактовая частота ": " 1600 МГц",
      " Профили Intel XMP ": " нет"
   },
   "Тайминги": {
      " CAS Latency (CL) ": " 11",
      " RAS to CAS Delay (tRCD) ": " 11",
      " Row Precharge Delay (tRP) ": " 11",
      " Activate to Precharge Delay (tRAS) ": " 28"
   },
   "Конструкция": {
      " Наличие радиатора ": " нет",
      " Подсветка элементов платы ": " нет",
      " Высота ": " 29 мм",
      " Низкопрофильная (Low Profile) ": " нет"
   },
   "Дополнительно": {
      " Напряжение питания ": " 1.5 В"
   },
   "Описание": "Оперативная память Patriot Signature [PSD34G16002] 4 ГБ форм-фактора DIMM предлагается пользователю в виде отдельной планки ОЗУ в прозрачном пластиковом блистере-футляре. Этим модулем памяти типа DDR3 можно укомплектовать собираемый системный блок, использовав его в качестве единственного модуля ОЗУ или одного из нескольких. Такая память может также стать инструментом апгрейда уже действующей машины с целью повышения ее быстродействия.  Оперативная память Patriot Signature [PSD34G16002] объемом 4 ГБ станет удачным выбором для системного блока любого назначения, поддерживающего работу с ОЗУ типа DDR3 DIMM. Она нуждается в питании с напряжением 1.5 В и поддерживает работу в диапазоне частот 800-1600 МГц. Память этой модели, рассчитанная на активную и продолжительную эксплуатацию, соответствует всем предъявляемым к подобным устройствам требованиям и стандартам индустрии.",
   "Цена": "5264 ₽"
}