{
   "Общие параметры": {
      " Тип ": "оперативная память",
      " Модель ": " AMD Radeon R9 Gamer Series",
      " Код производителя ": " [R9S48G3206U2S]"
   },
   "Объем и состав комплекта": {
      " Тип памяти ": "DDR4",
      " Форм-фактор памяти ": "DIMM",
      " Суммарный объем памяти всего комплекта ": " 8 ГБ",
      " Объем одного модуля памяти ": " 8 ГБ",
      " Количество модулей в комплекте ": " 1",
      " Регистровая память ": " нет",
      " ECC-память ": " нет"
   },
   "Быстродействие": {
      " Тактовая частота ": " 3200 МГц"
   },
   "Тайминги": {
      " CAS Latency (CL) ": " 16"
   },
   "Конструкция": {
      " Наличие радиатора ": " есть",
      " Подсветка элементов платы ": " нет",
      " Высота ": " 32 мм",
      " Низкопрофильная (Low Profile) ": " нет"
   },
   "Дополнительно": {
      " Напряжение питания ": " 1.35 В"
   },
   "Описание": "Соответствующая типу DDR4 оперативная память AMD Radeon R9 Gamer Series [R9S48G3206U2S] сможет эффективно проявить себя в составе игровых систем экстра-класса. Устройство, объем которого равен 8 ГБ, обладает впечатляющим набором технических характеристик. Скоростные возможности памяти во многом обеспечены благодаря использованию повышенного (до 1.35 В) напряжения питания. Опасность перегрева модуля исключена благодаря наличию радиатора. Высота модуля равна 32 мм. Память поставляется в коробке из прочного пластика. Упаковка надежно защищает содержимое от внешних воздействий в процессе транспортировки.  Тактовая частота памяти AMD Radeon R9 Gamer Series [R9S48G3206U2S] равна 3200 МГц. Разработчиками устройства предусмотрена поддержка и других частот. Минимально возможная частота равна 1866 МГц. Пропускная способность памяти соответствует высочайшим стандартам: величина этого показателя равна 25600 МБ/с. Модуль характеризуется показателем CAS-латентности 16.",
   "Цена": "3553 ₽"
}