{
   "Общие параметры": {
      " Тип ": "оперативная память",
      " Модель ": " Apacer",
      " Код производителя ": " [DL.04G2K.HAM]"
   },
   "Объем и состав комплекта": {
      " Тип памяти ": "DDR3",
      " Форм-фактор памяти ": "DIMM",
      " Суммарный объем памяти всего комплекта ": " 4 ГБ",
      " Объем одного модуля памяти ": " 4 ГБ",
      " Количество модулей в комплекте ": " 1",
      " Регистровая память ": " нет",
      " ECC-память ": " нет"
   },
   "Быстродействие": {
      " Тактовая частота ": " 1600 МГц",
      " Профили Intel XMP ": " нет"
   },
   "Тайминги": {
      " CAS Latency (CL) ": " 11",
      " RAS to CAS Delay (tRCD) ": " 11",
      " Row Precharge Delay (tRP) ": " 11"
   },
   "Конструкция": {
      " Наличие радиатора ": " нет",
      " Подсветка элементов платы ": " нет",
      " Высота ": " 30 мм",
      " Низкопрофильная (Low Profile) ": " нет"
   },
   "Дополнительно": {
      " Напряжение питания ": " 1.5 В"
   },
   "Описание": "Оперативная память Apacer [DL.04G2K.HAM] емкостью 4 ГБ — базовое решение для домашних и офисных систем начального уровня. Данная модель выполнена в форм-факторе DIMM и относится к типу DDR3. Рабочая частота модуля составляет 1600 МГц при пропускной способности PC12800. Благодаря этому, а также таймингам 11-11-11 обеспечивается высокая производительность в самых разных задачах. Другой особенностью модели является высокая надежность и отказоустойчивость, что обусловлено использованием первоклассных компонентов при производстве.  Оперативная память Apacer [DL.04G2K.HAM] имеет высоту 30 мм, благодаря чему может легко устанавливаться в самые разные компьютерные корпуса. Напряжение питания данной модели составляет 1.5 В. Модуль поставляется поштучно. Для наилучшего быстродействия рекомендуется использовать несколько идентичных планок памяти.",
   "Цена": [
      "999 ₽",
      "999 ₽"
   ]
}