{
   "Общие параметры": {
      " Тип ": "оперативная память",
      " Модель ": " Apacer",
      " Код производителя ": " [EL.04G2V.KNH]"
   },
   "Объем и состав комплекта": {
      " Тип памяти ": "DDR4",
      " Форм-фактор памяти ": "DIMM",
      " Суммарный объем памяти всего комплекта ": " 4 ГБ",
      " Объем одного модуля памяти ": " 4 ГБ",
      " Количество модулей в комплекте ": " 1",
      " Регистровая память ": " нет",
      " ECC-память ": " нет"
   },
   "Быстродействие": {
      " Тактовая частота ": " 2666 МГц",
      " Профили Intel XMP ": " нет"
   },
   "Тайминги": {
      " CAS Latency (CL) ": " 19",
      " RAS to CAS Delay (tRCD) ": " 19",
      " Row Precharge Delay (tRP) ": " 19",
      " Activate to Precharge Delay (tRAS) ": " 40"
   },
   "Конструкция": {
      " Наличие радиатора ": " нет",
      " Подсветка элементов платы ": " нет",
      " Высота ": " 31.25 мм",
      " Низкопрофильная (Low Profile) ": " нет"
   },
   "Дополнительно": {
      " Напряжение питания ": " 1.2 В"
   },
   "Описание": "4-гигабайтная оперативная память Apacer [EL.04G2V.KNH] выпускается широко известным производителем памяти разных видов. Тип устройства – DDR4. Память DDR4 является самой распространенной в настоящее время. Модуль обладает совместимостью с подавляющим большинством актуальных на сегодняшний день материнских плат.  Оперативная память Apacer [EL.04G2V.KNH] подходит для комплектации компьютеров, ориентированных на универсальное использование. Уровень производительности модуля достаточен для эффективного решения любых типовых задач. Тактовая частота памяти равна 2666 МГц, а пропускная способность – 21300 МБ/с. Помимо тактовой, устройство может использовать и другие частоты, наименьшей из которых является частота 1600 МГц. Тайминги модуля – 19-19-19-40. Для питания памяти используется стандартное для DDR4 напряжение: величина этого показателя равна 1.2 В. Высота модуля – 31.25 мм. Радиатор отсутствует. Компоновка чипов – односторонняя. На чипах размещена наклейка с техническими данными.",
   "Цена": "5803 ₽"
}