{
   "Общие параметры": {
      " Тип ": "оперативная память",
      " Модель ": " Patriot Signature",
      " Код производителя ": " [PSD38G13332]"
   },
   "Объем и состав комплекта": {
      " Тип памяти ": "DDR3",
      " Форм-фактор памяти ": "DIMM",
      " Суммарный объем памяти всего комплекта ": " 8 ГБ",
      " Объем одного модуля памяти ": " 8 ГБ",
      " Количество модулей в комплекте ": " 1",
      " Регистровая память ": " нет",
      " ECC-память ": " нет"
   },
   "Быстродействие": {
      " Тактовая частота ": " 1333 МГц",
      " Профили Intel XMP ": " нет"
   },
   "Тайминги": {
      " CAS Latency (CL) ": " 9",
      " RAS to CAS Delay (tRCD) ": " 9",
      " Row Precharge Delay (tRP) ": " 9",
      " Activate to Precharge Delay (tRAS) ": " 24"
   },
   "Конструкция": {
      " Наличие радиатора ": " нет",
      " Подсветка элементов платы ": " нет",
      " Высота ": " 29 мм",
      " Низкопрофильная (Low Profile) ": " нет"
   },
   "Дополнительно": {
      " Напряжение питания ": " 1.5 В"
   },
   "Описание": "8-гигабайтная оперативная память Patriot Signature [PSD38G13332] применяется для комплектации домашних и офисных компьютеров, используемых для работы с программами офисного класса. Модуль относится к типу DDR3, который все еще достаточно популярен в настоящее время. Память ориентирована на стабильность функционирования, но ее скоростные характеристики позволяют решать множество задач.  Оперативная память Patriot Signature [PSD38G13332] использует тактовую частоту 1333 МГц. Если ваша материнская плата не поддерживает эту частоту, то вы сможете использовать частоты 800 и 1066 МГц. Пропускная способность устройства равна 10600 МБ/с. Память соответствует таймингам 9-9-9-24.  Модуль памяти изготовлен с применением текстолита традиционного, зеленого цвета. Чипы памяти расположены с одной стороны. Имеется наклейка, содержащая информацию об основных технических характеристиках памяти. Высота модуля памяти равна 29 мм. Для питания модели используется типовое для DDR3 напряжение, составляющее 1.5 В.",
   "Цена": "5244 ₽"
}