{
   "Общие параметры": {
      " Тип ": "оперативная память",
      " Модель ": " AMD Radeon R3 Value Series",
      " Код производителя ": " [R322G805U2S-UG]"
   },
   "Объем и состав комплекта": {
      " Тип памяти ": "DDR2",
      " Форм-фактор памяти ": "DIMM",
      " Суммарный объем памяти всего комплекта ": " 2 ГБ",
      " Объем одного модуля памяти ": " 2 ГБ",
      " Количество модулей в комплекте ": " 1",
      " Регистровая память ": " нет",
      " ECC-память ": " нет"
   },
   "Быстродействие": {
      " Тактовая частота ": " 800 МГц",
      " Профили Intel XMP ": " нет"
   },
   "Тайминги": {
      " CAS Latency (CL) ": " 6",
      " RAS to CAS Delay (tRCD) ": " 6",
      " Row Precharge Delay (tRP) ": " 6",
      " Activate to Precharge Delay (tRAS) ": " 18"
   },
   "Конструкция": {
      " Наличие радиатора ": " нет",
      " Подсветка элементов платы ": " нет",
      " Высота ": " 30 мм",
      " Низкопрофильная (Low Profile) ": " нет"
   },
   "Дополнительно": {
      " Напряжение питания ": " 1.8 В"
   },
   "Описание": "Оперативная память AMD Radeon R3 Value Series [R322G805U2S-UG] является отличным решением для неигровых компьютерных систем, использующихся преимущественно для офисной работы. Представленный модуль имеет объем ОЗУ 2 ГБ, которого будет вполне достаточно для быстродействия операционной системы при запуске различного софта, требующегося для работы пользователя. Оперативная память обладает форм-фактором DIMM DDR2, ее рабочее напряжение равняется 1.8 В. Сильной стороной модели для ОЗУ рассматриваемого класса является высокая пропускная способность, соответствующая PC6400. Тайминги 6-6-6-18 делают плашку популярной среди многочисленных пользователей.  Оперативная память AMD Radeon R3 Value Series [R322G805U2S-UG] имеет тактовую частоту 800 МГц, при этом поддерживаются еще несколько режимов работы модуля: 400 МГц, 533 МГц и 667 МГц. Представленная плашка имеет высоту, равняющуюся 30 мм. Комплект поставки предусматривает один модуль оперативной памяти, чьи конструктивные элементы располагаются на текстолите зеленого цвета.",
   "Цена": "3623 ₽"
}