{
   "Общие параметры": {
      " Тип ": "оперативная память",
      " Модель ": " AMD Radeon R7 Performance Series",
      " Код производителя ": " [R748G2606U2S-U]"
   },
   "Объем и состав комплекта": {
      " Тип памяти ": "DDR4",
      " Форм-фактор памяти ": "DIMM",
      " Суммарный объем памяти всего комплекта ": " 8 ГБ",
      " Объем одного модуля памяти ": " 8 ГБ",
      " Количество модулей в комплекте ": " 1",
      " Регистровая память ": " нет",
      " ECC-память ": " нет"
   },
   "Быстродействие": {
      " Тактовая частота ": " 2666 МГц"
   },
   "Тайминги": {
      " CAS Latency (CL) ": " 16",
      " RAS to CAS Delay (tRCD) ": " 18",
      " Row Precharge Delay (tRP) ": " 18",
      " Activate to Precharge Delay (tRAS) ": " 35"
   },
   "Конструкция": {
      " Наличие радиатора ": " нет",
      " Подсветка элементов платы ": " нет",
      " Высота ": " 31.25 мм",
      " Низкопрофильная (Low Profile) ": " нет"
   },
   "Дополнительно": {
      " Напряжение питания ": " 1.2 В"
   },
   "Описание": "Оперативная память AMD Radeon R7 Performance Series [R748G2606U2S-U] представляет собой один из важнейших комплектующих элементов любого компьютера, который обеспечит операционную систему необходимыми ресурсами для быстродействия в многозадачном режиме работы. Данная модель отличается высокой производительностью и полным соответствием передовым стандартам качества и надежности. Емкость представленного модуля оперативной памяти достигает 8 ГБ, в комплекте поставки предусмотрена одна плашка ОЗУ.  Оперативная память AMD Radeon R7 Performance Series [R748G2606U2S-U] функционирует на частоте 2666 МГц, также поддерживаются режимы работы на частотах 1600 МГц, 1866 МГц, 2133 МГц и 2400 МГц. Модуль относится к типу DIMM DDR4, его напряжение питания не превысит 1.2 В. Пропускная способность представленной модели оперативной памяти соответствует PC21300. Плашка ОЗУ сертифицирована и оптимизирована под платформу AMD для максимальной совместимости компьютерных компонентов. Тайминги представленной модели - 16-18-18-35.",
   "Цена": "3631 ₽"
}