{
   "Общие параметры": {
      " Тип ": "оперативная память",
      " Модель ": " Patriot Signature",
      " Код производителя ": " [PSD34G1600L81]"
   },
   "Объем и состав комплекта": {
      " Тип памяти ": "DDR3L",
      " Форм-фактор памяти ": "DIMM",
      " Суммарный объем памяти всего комплекта ": " 4 ГБ",
      " Объем одного модуля памяти ": " 4 ГБ",
      " Количество модулей в комплекте ": " 1",
      " Регистровая память ": " нет",
      " ECC-память ": " нет"
   },
   "Быстродействие": {
      " Тактовая частота ": " 1600 МГц",
      " Профили Intel XMP ": " нет"
   },
   "Тайминги": {
      " CAS Latency (CL) ": " 11",
      " RAS to CAS Delay (tRCD) ": " 11",
      " Row Precharge Delay (tRP) ": " 11",
      " Activate to Precharge Delay (tRAS) ": " 28"
   },
   "Конструкция": {
      " Наличие радиатора ": " нет",
      " Подсветка элементов платы ": " нет",
      " Высота ": " 32 мм",
      " Низкопрофильная (Low Profile) ": " нет"
   },
   "Дополнительно": {
      " Напряжение питания ": " 1.35 В"
   },
   "Описание": "Оперативная память Patriot Signature [PSD34G1600L81] 4 ГБ – идеальное решение для вашего ПК. Необходимо расширить объем ОЗУ, добавить планку или заменить старый модуль? При помощи представленной плашки удается справиться с данной задачей. Она изготовлена крупным производителем, который предлагает надежную продукцию для применения.  Установка модуля Patriot Signature [PSD34G1600L81] 4 ГБ осуществляется легко. Он принадлежит к форм-фактору DIMM. Такие элементы пользуются спросом, они являются полноразмерными. Монтаж происходит в слот на плате, необходимо несколько минут для замены.  Объем памяти составляет 4 ГБ. Этого окажется достаточно при последующем использовании. Планка принадлежит к типу DDR3L и обладает прекрасными параметрами. Максимальная частота – 1600 МГц. Конкретный показатель зависит от комплектующих, поддерживается несколько режимов работы.  Благодаря высокой частоте можно увеличить быстродействие ПК. Удается легко переключаться между несколькими программами. Тайминги 11-11-11-28 положительно сказываются на характеристиках.  Высота планки составляет 32 мм. Напряжение для питания стандартное для данных элементов – 1.35 В. При помощи модулей можно улучшить компьютер для комфортной работы.",
   "Цена": "5430 ₽"
}