{
   "Общие параметры": {
      " Тип ": "оперативная память",
      " Модель ": " AMD Radeon R5 Entertainment Series",
      " Код производителя ": " [R5S34G1601U1S]"
   },
   "Объем и состав комплекта": {
      " Тип памяти ": "DDR3",
      " Форм-фактор памяти ": "DIMM",
      " Суммарный объем памяти всего комплекта ": " 4 ГБ",
      " Объем одного модуля памяти ": " 4 ГБ",
      " Количество модулей в комплекте ": " 1",
      " Регистровая память ": " нет",
      " ECC-память ": " нет",
      " Ранговость ": " одноранговая"
   },
   "Быстродействие": {
      " Тактовая частота ": " 1600 МГц",
      " Профили Intel XMP ": " нет"
   },
   "Тайминги": {
      " CAS Latency (CL) ": " 11",
      " RAS to CAS Delay (tRCD) ": " 11",
      " Row Precharge Delay (tRP) ": " 11",
      " Activate to Precharge Delay (tRAS) ": " 28"
   },
   "Конструкция": {
      " Наличие радиатора ": " есть",
      " Подсветка элементов платы ": " нет",
      " Высота ": " 30 мм",
      " Низкопрофильная (Low Profile) ": " нет"
   },
   "Дополнительно": {
      " Напряжение питания ": " 1.5 В"
   },
   "Описание": "Оперативная память AMD Radeon R5 Entertainment Series [R5S34G1601U1S] имеет объем, составляющий 4 ГБ. Перед вами – игровое устройство, рассчитанное на использование в составе системных блоков, которые комплектуются модулями памяти DDR3. Уровень производительности модуля достаточен для обработки больших массивов данных в интенсивном режиме. Пропускная способность памяти составляет 12800 МБ/с. Используется тактовая частота 1600 МГц. Модуль может функционировать и на других (800, 1066 и 1333 МГц) частотах. Память характеризуется таймингами 11-11-11-28.  Память AMD Radeon R5 Entertainment Series [R5S34G1601U1S] оборудована радиатором, с помощью которого достигается высокая эффективность отвода тепла. Радиатор компактен: он не увеличивает высоту модуля, которая равна типовым 30 мм. Напряжение питания памяти стандартно для DDR3: величина этого показателя равна 1.5 В. Модуль имеет стильный внешний вид: на радиаторе с обеих сторон размещен всемирно известный логотип производителя. Устройство поставляется в пластиковой коробке типовой конструкции.",
   "Цена": [
      "999 ₽",
      "999 ₽"
   ]
}