{
   "Общие параметры": {
      " Тип ": "оперативная память",
      " Модель ": " Patriot Signature",
      " Код производителя ": " [PSD38G16002]"
   },
   "Объем и состав комплекта": {
      " Тип памяти ": "DDR3",
      " Форм-фактор памяти ": "DIMM",
      " Суммарный объем памяти всего комплекта ": " 8 ГБ",
      " Объем одного модуля памяти ": " 8 ГБ",
      " Количество модулей в комплекте ": " 1",
      " Регистровая память ": " нет",
      " ECC-память ": " нет"
   },
   "Быстродействие": {
      " Тактовая частота ": " 1600 МГц",
      " Профили Intel XMP ": " нет"
   },
   "Тайминги": {
      " CAS Latency (CL) ": " 11",
      " RAS to CAS Delay (tRCD) ": " 11",
      " Row Precharge Delay (tRP) ": " 11",
      " Activate to Precharge Delay (tRAS) ": " 28"
   },
   "Конструкция": {
      " Наличие радиатора ": " нет",
      " Подсветка элементов платы ": " нет",
      " Высота ": " 29 мм",
      " Низкопрофильная (Low Profile) ": " нет"
   },
   "Дополнительно": {
      " Напряжение питания ": " 1.5 В"
   },
   "Описание": "Оперативная память Patriot Signature [PSD38G16002] – отличный вариант для установки в стационарные компьютеры, использующие оперативную память широко распространенного типа DDR3. Значительный (8 ГБ) объем модуля памяти позволяет использовать его не только в комбинации с другими модулями, но и в качестве единственного модуля. Применение устройства будет оправдано в производительных рабочих станциях и игровых компьютерах начального и среднего уровня.  Память Patriot Signature [PSD38G16002] использует тактовую частоту 1600 МГц. Возможна работа на частотах 800, 1066, 1333 МГц. Устройство имеет пропускную способность 12800 МБ/с и характеризуется таймингами 11-11-11-28.  Модуль памяти Patriot Signature [PSD38G16002] использует напряжение питания, равное 1.5 В. Высота устройства составляет 29 мм. Модуль поставляется в компактной упаковке, конструкция которой позволяет ознакомиться с внешним видом памяти. На упаковку нанесена наклейка с информацией о кратких технических характеристиках модели.",
   "Цена": "4821 ₽"
}