{
   "Общие параметры": {
      " Тип ": "оперативная память",
      " Модель ": " AMD Radeon R7 Performance Series",
      " Код производителя ": " [R744G2606U1S-U]"
   },
   "Объем и состав комплекта": {
      " Тип памяти ": "DDR4",
      " Форм-фактор памяти ": "DIMM",
      " Суммарный объем памяти всего комплекта ": " 4 ГБ",
      " Объем одного модуля памяти ": " 4 ГБ",
      " Количество модулей в комплекте ": " 1",
      " Регистровая память ": " нет",
      " ECC-память ": " нет"
   },
   "Быстродействие": {
      " Тактовая частота ": " 2666 МГц",
      " Профили Intel XMP ": " нет"
   },
   "Тайминги": {
      " CAS Latency (CL) ": " 16",
      " RAS to CAS Delay (tRCD) ": " 18",
      " Row Precharge Delay (tRP) ": " 18",
      " Activate to Precharge Delay (tRAS) ": " 35"
   },
   "Конструкция": {
      " Наличие радиатора ": " нет",
      " Подсветка элементов платы ": " нет",
      " Высота ": " 31 мм",
      " Низкопрофильная (Low Profile) ": " нет"
   },
   "Дополнительно": {
      " Напряжение питания ": " 1.2 В"
   },
   "Описание": "Оперативная память AMD Radeon R7 Performance Series CL16 подарит вашей компьютерной системе быстродействие и производительность в процессе работы в многозадачном режиме. Модуль памяти обладает оптимальным объемом, равным 4 ГБ, и высокой частотой, показатель которой соответствует 2666 МГц. Отличительной особенностью представленной модели являются минимальные уровни задержки и латентности - 16-18-18-35. Общий показатель скорости соответствует уровню PC21300. Каждая деталь в представленной плашке оптимизирована на высокую производительность, исключающую ECC и буферизацию.  Он полностью покрывает микросхемы модуля, обеспечивая его эффективное охлаждение. Модель поставляется в стандартном 288-контактном форм-факторе. Модуль имеет форм-фактор DIMM и относится к типу памяти DDR4. Плашка ОЗУ станет оптимальным решением и для офисного компьютера, и для мощной игровой компьютерной машины. Высота модуля равняется 31 мм.",
   "Цена": "3518 ₽"
}