{
   "Общие параметры": {
      " Тип ": "оперативная память",
      " Модель ": " Patriot Signature",
      " Код производителя ": " [PSD34G160081]"
   },
   "Объем и состав комплекта": {
      " Тип памяти ": "DDR3",
      " Форм-фактор памяти ": "DIMM",
      " Суммарный объем памяти всего комплекта ": " 4 ГБ",
      " Объем одного модуля памяти ": " 4 ГБ",
      " Количество модулей в комплекте ": " 1",
      " Регистровая память ": " нет",
      " ECC-память ": " нет"
   },
   "Быстродействие": {
      " Тактовая частота ": " 1600 МГц",
      " Профили Intel XMP ": " нет"
   },
   "Тайминги": {
      " CAS Latency (CL) ": " 11",
      " RAS to CAS Delay (tRCD) ": " 11",
      " Row Precharge Delay (tRP) ": " 11",
      " Activate to Precharge Delay (tRAS) ": " 28"
   },
   "Конструкция": {
      " Наличие радиатора ": " нет",
      " Подсветка элементов платы ": " нет",
      " Высота ": " 30 мм",
      " Низкопрофильная (Low Profile) ": " нет"
   },
   "Дополнительно": {
      " Напряжение питания ": " 1.5 В"
   },
   "Описание": "Оперативная память Patriot Signature [PSD34G160081] станет отличным выбором для владельцев офисных и домашних компьютеров, предназначенных для использования оперативной памяти, соответствующей типу DDR3. Емкость модуля памяти равняется 4 ГБ: доступно его использование как в качестве единственного модуля памяти, так и в сочетании с другими модулями. Устройство характеризуется высоким уровнем надежности, и может использоваться при высоких нагрузках.  Модуль памяти Patriot Signature [PSD34G160081] имеет тактовую частоту 1600 МГц. Допускается работа на частотах 800, 1066 и 1333 МГц. Пропускная способность рассматриваемого комплектующего элемента равна 12800 МБ/с. Модуль характеризуется таймингами 11-11-11-28.  При производстве Patriot Signature [PSD34G160081] был использован текстолит зеленого цвета. Высота модуля памяти составляет 30 мм. Модель использует напряжение питания, равное 1.5 В. На корпус модуля памяти нанесена наклейка, на которой кратко перечислены технические характеристики устройства.",
   "Цена": "5338 ₽"
}