{
   "Общие параметры": {
      " Тип ": "оперативная память",
      " Модель ": " Patriot Signature Line Premium",
      " Код производителя ": " [PSP48G320081H1]"
   },
   "Объем и состав комплекта": {
      " Тип памяти ": "DDR4",
      " Форм-фактор памяти ": "DIMM",
      " Суммарный объем памяти всего комплекта ": " 8 ГБ",
      " Объем одного модуля памяти ": " 8 ГБ",
      " Количество модулей в комплекте ": " 1",
      " Регистровая память ": " нет",
      " ECC-память ": " нет",
      " Ранговость ": " одноранговая"
   },
   "Быстродействие": {
      " Тактовая частота ": " 3200 МГц",
      " Профили Intel XMP ": " нет"
   },
   "Тайминги": {
      " CAS Latency (CL) ": " 22",
      " RAS to CAS Delay (tRCD) ": " 22",
      " Row Precharge Delay (tRP) ": " 22",
      " Activate to Precharge Delay (tRAS) ": " 52"
   },
   "Конструкция": {
      " Наличие радиатора ": " есть",
      " Цвет радиатора ": " черный",
      " Подсветка элементов платы ": " нет",
      " Высота ": " 37 мм",
      " Низкопрофильная (Low Profile) ": " нет"
   },
   "Дополнительно": {
      " Напряжение питания ": " 1.2 В"
   },
   "Описание": "Оперативная память Patriot Signature Line Premium [PSP48G320081H1] отличается высокой производительностью и может стать отличным выбором для игровых и рабочих систем начального и среднего класса. Емкость данной модели составляет 8 ГБ, что позволяет комфортно работать с фото и видео, обрабатывать большие массивы данных, а также запускать требовательные к ресурсам приложения. Другой особенностью оперативной памяти является ее соответствие стандарту DDR4. Благодаря этому рабочая частота может достигать 3200 МГц при пропускной способности 25600 МБ/с, что вкупе с минимальной латентностью положительно влияет на быстродействие системы.  Оперативная память Patriot Signature Line Premium [PSP48G320081H1] выполнена в классическом корпусе формата DIMM с высотой 37 мм, благодаря чему может легко и удобно монтироваться на материнские платы практически любого размера. Отличительной особенностью конструкции является наличие радиатора пассивного охлаждения, благодаря которому обеспечивается оптимальный температурный режим в процессе работы. Напряжение питания не превышает 1.2 В. Комплект поставки включает в себя 1 модуль. Для достижения наилучших показателей производительности и стабильной работы системы рекомендуется использовать парное количество идентичных планок оперативной памяти.",
   "Цена": "4542 ₽"
}