{
   "Общие параметры": {
      " Тип ": "оперативная память",
      " Модель ": " Patriot Signature Line",
      " Код производителя ": " [PSD48G266682]"
   },
   "Объем и состав комплекта": {
      " Тип памяти ": "DDR4",
      " Форм-фактор памяти ": "DIMM",
      " Суммарный объем памяти всего комплекта ": " 8 ГБ",
      " Объем одного модуля памяти ": " 8 ГБ",
      " Количество модулей в комплекте ": " 1",
      " Регистровая память ": " нет",
      " ECC-память ": " нет"
   },
   "Быстродействие": {
      " Тактовая частота ": " 2666 МГц",
      " Профили Intel XMP ": " нет"
   },
   "Тайминги": {
      " CAS Latency (CL) ": " 19",
      " RAS to CAS Delay (tRCD) ": " 19",
      " Row Precharge Delay (tRP) ": " 19",
      " Activate to Precharge Delay (tRAS) ": " 43"
   },
   "Конструкция": {
      " Наличие радиатора ": " нет",
      " Подсветка элементов платы ": " нет",
      " Высота ": " 31.25 мм",
      " Низкопрофильная (Low Profile) ": " нет"
   },
   "Дополнительно": {
      " Напряжение питания ": " 1.2 В"
   },
   "Описание": "8-гигабайтная оперативная память Patriot Signature Line [PSD48G266682] может использоваться при сборке или модернизации домашних и офисных компьютеров, обеспечивающих типовой уровень производительности. Модель соответствует типу DDR4. Память отличается высоким уровнем надежности и безупречной совместимостью с любыми качественными комплектующими.  Тактовая частота памяти Patriot Signature Line [PSD48G266682] равна 2666 МГц. Пропускная способность составляет 21300 МБ/с. Устройство способно использовать и другие частоты. Минимальная рабочая частота – 1600 МГц. Тайминги памяти – 19-19-19-43.  Напряжение питания – 1.2 В. Высота модуля – 31.25 мм. Компоновка чипов памяти – двусторонняя.",
   "Цена": "4214 ₽"
}