{
   "Общие параметры": {
      " Тип ": "оперативная память",
      " Модель ": " AMD Radeon R9 Gamer Series",
      " Код производителя ": " [R9S48G3606U2S]"
   },
   "Объем и состав комплекта": {
      " Тип памяти ": "DDR4",
      " Форм-фактор памяти ": "DIMM",
      " Суммарный объем памяти всего комплекта ": " 8 ГБ",
      " Объем одного модуля памяти ": " 8 ГБ",
      " Количество модулей в комплекте ": " 1",
      " Регистровая память ": " нет",
      " ECC-память ": " нет"
   },
   "Быстродействие": {
      " Тактовая частота ": " 3600 МГц"
   },
   "Тайминги": {
      " CAS Latency (CL) ": " 18"
   },
   "Конструкция": {
      " Наличие радиатора ": " есть",
      " Цвет радиатора ": " черный",
      " Подсветка элементов платы ": " нет",
      " Высота ": " 32 мм",
      " Низкопрофильная (Low Profile) ": " нет"
   },
   "Дополнительно": {
      " Напряжение питания ": " 1.35 В"
   },
   "Описание": "Оперативная память AMD Radeon R9 Gamer Series [R9S48G3606U2S] представляет собой производительное решение для настольных компьютеров. Данная модель обладает емкостью 8 ГБ и относится к типу DDR4, за счет чего отличается высокими рабочими показателями и может повысить быстродействие системы в различных сценариях использования – например, при работе с базами данных, с фото и видео или в играх.  Корпус AMD Radeon R9 Gamer Series соответствует DIMM-формату, благодаря чему может использоваться в различных конфигурациях компьютерных сборок. Отличительной особенностью модели является встроенный радиатор охлаждения. Благодаря особой конструкции и используемым материалам он отличается высокой теплопроводностью и эффективностью, предотвращая перегрев даже при значительных нагрузках.  Другой особенностью модуля памяти является малая высота – всего 32 мм, что вкупе со стандартными креплениями обеспечивает простую и быструю установку на материнскую плату. Напряжение питания модели составляет 1.35 В.",
   "Цена": "3391 ₽"
}