{
   "Общие параметры": {
      " Тип ": "оперативная память",
      " Модель ": " Patriot Signature Line",
      " Код производителя ": " [PSD44G266681]"
   },
   "Объем и состав комплекта": {
      " Тип памяти ": "DDR4",
      " Форм-фактор памяти ": "DIMM",
      " Суммарный объем памяти всего комплекта ": " 4 ГБ",
      " Объем одного модуля памяти ": " 4 ГБ",
      " Количество модулей в комплекте ": " 1",
      " Регистровая память ": " нет",
      " ECC-память ": " нет"
   },
   "Быстродействие": {
      " Тактовая частота ": " 2666 МГц",
      " Профили Intel XMP ": " нет"
   },
   "Тайминги": {
      " CAS Latency (CL) ": " 19",
      " RAS to CAS Delay (tRCD) ": " 19",
      " Row Precharge Delay (tRP) ": " 19",
      " Activate to Precharge Delay (tRAS) ": " 43"
   },
   "Конструкция": {
      " Наличие радиатора ": " нет",
      " Подсветка элементов платы ": " нет",
      " Высота ": " 31 мм",
      " Низкопрофильная (Low Profile) ": " нет"
   },
   "Дополнительно": {
      " Напряжение питания ": " 1.2 В"
   },
   "Описание": "Оперативная память Patriot Signature Line [PSD44G266681] 4 ГБ относится к типу DIMM DDR4 и характеризуется пропускной способностью PC21300, поддерживая работу с тактовой частотой 2666 МГц. Этот компонент характеризуется объемом 4 ГБ и подходит для применения в домашней станции или рабочей машине для офиса. Эта планка может выступать в качестве основного и единственного модуля ОЗУ в вашей сборке, но допускает и параллельную работу с другой планкой, близкой по рабочим параметрам.  Оперативную память Patriot Signature Line [PSD44G266681], рассчитанную на работу при входном напряжении 1.2 В, можно использовать как средство апгрейда системного блока, быстродействие которого не устраивает вас. Модуль снабжается теплоотводом, расположенным над чипами памяти и платой. Благодаря черному радиатору процесс рассеивания тепла от нагревающегося при работе компонента идет более интенсивно.",
   "Цена": [
      "1 050 ₽",
      "1 050 ₽"
   ]
}