{
   "Общие параметры": {
      " Тип ": "оперативная память",
      " Модель ": " Patriot Signature",
      " Код производителя ": " [PSD44G240081]"
   },
   "Объем и состав комплекта": {
      " Тип памяти ": "DDR4",
      " Форм-фактор памяти ": "DIMM",
      " Суммарный объем памяти всего комплекта ": " 4 ГБ",
      " Объем одного модуля памяти ": " 4 ГБ",
      " Количество модулей в комплекте ": " 1",
      " Регистровая память ": " нет",
      " ECC-память ": " нет"
   },
   "Быстродействие": {
      " Тактовая частота ": " 2400 МГц",
      " Профили Intel XMP ": " нет"
   },
   "Тайминги": {
      " CAS Latency (CL) ": " 17",
      " RAS to CAS Delay (tRCD) ": " 17",
      " Row Precharge Delay (tRP) ": " 17",
      " Activate to Precharge Delay (tRAS) ": " 39"
   },
   "Конструкция": {
      " Наличие радиатора ": " нет",
      " Подсветка элементов платы ": " нет",
      " Высота ": " 31.25 мм",
      " Низкопрофильная (Low Profile) ": " нет"
   },
   "Дополнительно": {
      " Напряжение питания ": " 1.2 В"
   },
   "Описание": "4-гигабайтная оперативная память Patriot Signature [PSD44G240081] станет для вас отличным выбором, если вам нужен скоростной модуль памяти DDR4 сравнительно небольшого объема. Эта память является оптимальным вариантом для комплектации домашнего или офисного компьютера, рассчитанного на использование типового набора программ. Модель обладает впечатляющей пропускной способностью: 19200 МБ/с. Память характеризуется таймингами 17-17-17-39, и использует тактовую частоту 2400 МГц. Есть возможность использовать и другие частоты: 1600, 1866 и 2133 МГц.  Оперативная память Patriot Signature [PSD44G240081] использует для питания напряжение, равное 1.2 В. Чипы памяти установлены с одной стороны модуля. Высота модуля памяти стандартна для такого класса устройств: она равна 31,25 мм. Информация о кратких технических характеристиках устройства расположена на наклейке, которая нанесена на чипы памяти. В качестве упаковки модуля памяти использован пластиковый мини-бокс, который надежно защищает память от повреждений в процессе транспортировки.",
   "Цена": "4282 ₽"
}