{
   "Общие параметры": {
      " Тип ": "оперативная память",
      " Модель ": " Apacer",
      " Код производителя ": " [EL.08G2V.GNH]"
   },
   "Объем и состав комплекта": {
      " Тип памяти ": "DDR4",
      " Форм-фактор памяти ": "DIMM",
      " Суммарный объем памяти всего комплекта ": " 8 ГБ",
      " Объем одного модуля памяти ": " 8 ГБ",
      " Количество модулей в комплекте ": " 1",
      " Регистровая память ": " нет",
      " ECC-память ": " нет"
   },
   "Быстродействие": {
      " Тактовая частота ": " 2666 МГц",
      " Профили Intel XMP ": " нет"
   },
   "Тайминги": {
      " CAS Latency (CL) ": " 19",
      " RAS to CAS Delay (tRCD) ": " 19",
      " Row Precharge Delay (tRP) ": " 19",
      " Activate to Precharge Delay (tRAS) ": " 40"
   },
   "Конструкция": {
      " Наличие радиатора ": " нет",
      " Подсветка элементов платы ": " нет",
      " Высота ": " 31.25 мм",
      " Низкопрофильная (Low Profile) ": " нет"
   },
   "Дополнительно": {
      " Напряжение питания ": " 1.2 В"
   },
   "Описание": "Оперативная память Apacer [EL.08G2V.GNH] имеет объем, составляющий 8 ГБ. Устройство соответствует самому распространенному на данный момент типу – DDR4. Память обладает высоким уровнем надежности. Модуль может с успехом эксплуатироваться в составе универсального офисного или домашнего компьютера. Уровень производительности памяти достаточен для эффективного функционирования любых типовых программ.  Память Apacer [EL.08G2V.GNH] обладает совместимостью с подавляющим большинством материнских плат, которые эксплуатируются в настоящее время. Тактовая частота устройства – 2666 МГц. Пропускная способность памяти – 21300 МБ/с. Помимо тактовой, модуль может использовать для работы другие частоты, наименьшая из которых – 1600 МГц. Тайминги памяти – 19-19-19-40.  Напряжение питания памяти – 1.2 В. Это стандартный показатель для DDR4. Радиатор конструкцией модуля не предусмотрен. Чипы смонтированы с одной стороны модуля. На чипы нанесена наклейка с краткой технической информацией. Высота модуля составляет типовые 31.25 мм.",
   "Цена": "3069 ₽"
}