{
   "Общие параметры": {
      " Тип ": "оперативная память",
      " Модель ": " Patriot Signature Line",
      " Код производителя ": " [PSD34G133381]"
   },
   "Объем и состав комплекта": {
      " Тип памяти ": "DDR3",
      " Форм-фактор памяти ": "DIMM",
      " Суммарный объем памяти всего комплекта ": " 4 ГБ",
      " Объем одного модуля памяти ": " 4 ГБ",
      " Количество модулей в комплекте ": " 1",
      " Регистровая память ": " нет",
      " ECC-память ": " нет"
   },
   "Быстродействие": {
      " Тактовая частота ": " 1333 МГц",
      " Профили Intel XMP ": " нет"
   },
   "Тайминги": {
      " CAS Latency (CL) ": " 9",
      " RAS to CAS Delay (tRCD) ": " 9",
      " Row Precharge Delay (tRP) ": " 9",
      " Activate to Precharge Delay (tRAS) ": " 24"
   },
   "Конструкция": {
      " Наличие радиатора ": " нет",
      " Подсветка элементов платы ": " нет",
      " Высота ": " 31 мм",
      " Низкопрофильная (Low Profile) ": " нет"
   },
   "Дополнительно": {
      " Напряжение питания ": " 1.5 В"
   },
   "Описание": "Ищете надежные комплектующие для компьютера? Оперативная память Patriot Signature Line [PSD34G133381] 4 ГБ – прекрасное решение для различных ПК. Она рекомендована для рабочих компьютеров, обладает сбалансированными характеристиками.  Оперативная память Patriot Signature Line [PSD34G133381] 4 ГБ пригодится при замене старых планок, или при расширении объема ОЗУ. Покупатель получает один модуль на 4 ГБ. Его можно использовать вместе с другими плашками, если они имеют одинаковые характеристики.  Модуль принадлежит к типу DDR3. Важно проверить его совместимость с системной платой и процессором вашего компьютера. Рабочая частота планки – 1333 МГц. Дополнительно модуль поддерживает режимы на 800 и 1066 МГц, в зависимости от параметров сборки.  Устанавливается планка в слот на материнской плате. Модуль принадлежит к формату DIMM, который используется в стационарных компьютерах. Процедура подключения плашки к плате не вызовет затруднений у владельца. Напряжение подаваемого питания на модуль – 1.5 В.",
   "Цена": [
      "1 050 ₽",
      "1 050 ₽"
   ]
}