{
   "Общие параметры": {
      " Тип ": "оперативная память",
      " Модель ": " AMD Radeon R5 Entertainment Series",
      " Код производителя ": " [R534G1601U1SL-U]"
   },
   "Объем и состав комплекта": {
      " Тип памяти ": "DDR3L",
      " Форм-фактор памяти ": "DIMM",
      " Суммарный объем памяти всего комплекта ": " 4 ГБ",
      " Объем одного модуля памяти ": " 4 ГБ",
      " Количество модулей в комплекте ": " 1",
      " Регистровая память ": " нет",
      " ECC-память ": " нет"
   },
   "Быстродействие": {
      " Тактовая частота ": " 1600 МГц",
      " Профили Intel XMP ": " нет"
   },
   "Тайминги": {
      " CAS Latency (CL) ": " 11",
      " RAS to CAS Delay (tRCD) ": " 11",
      " Row Precharge Delay (tRP) ": " 11",
      " Activate to Precharge Delay (tRAS) ": " 28"
   },
   "Конструкция": {
      " Наличие радиатора ": " нет",
      " Подсветка элементов платы ": " нет",
      " Высота ": " 30 мм",
      " Низкопрофильная (Low Profile) ": " нет"
   },
   "Дополнительно": {
      " Напряжение питания ": " 1.35 В"
   },
   "Описание": "Если компьютер уже не так быстр, как раньше, загрузка «тяжелых» программ и приложений \"подвисает\" все больше, а комфортная игра становится все менее доступной, тогда вы сможете легко и с минимумом затрат усилий и времени решить это благодаря оперативной памяти AMD Radeon R5 Entertainment Series [R534G1601U1SL-U]. Ведь данная оперативная память форм-фактора DIMM сможет ощутимо увеличить возможности вашего компьютера. AMD Radeon R5 Entertainment Series [R534G1601U1SL-U] выполнена по технологии DDR3L и предоставит вам 4 ГБ оперативной памяти, способной работать на частотах от 800 МГц до 1600 МГц. Высота этой карты всего 30 миллиметров, а напряжения для питания потребуется только 1.35 В. Просто вставьте данную карту в нужный слот и насладитесь тем, насколько быстрее и лучше стал работать уже такой полюбившийся и привычный для вас компьютер.",
   "Цена": "3346 ₽"
}