{
   "Общие параметры": {
      " Тип ": "оперативная память",
      " Модель ": " QUMO",
      " Код производителя ": " [QUM4U-8G2400P16]"
   },
   "Объем и состав комплекта": {
      " Тип памяти ": "DDR4",
      " Форм-фактор памяти ": "DIMM",
      " Суммарный объем памяти всего комплекта ": " 8 ГБ",
      " Объем одного модуля памяти ": " 8 ГБ",
      " Количество модулей в комплекте ": " 1",
      " Регистровая память ": " нет",
      " ECC-память ": " нет"
   },
   "Быстродействие": {
      " Тактовая частота ": " 2400 МГц",
      " Профили Intel XMP ": " нет"
   },
   "Тайминги": {
      " CAS Latency (CL) ": " 16"
   },
   "Конструкция": {
      " Наличие радиатора ": " нет",
      " Подсветка элементов платы ": " нет",
      " Высота ": " 31.25 мм",
      " Низкопрофильная (Low Profile) ": " нет"
   },
   "Дополнительно": {
      " Напряжение питания ": " 1.2 В"
   },
   "Описание": "Оперативная память QUMO [QUM4U-8G2400P16] 8 ГБ подойдет для установки в различные компьютеры. Ее можно использовать как для рабочих ПК, так и в универсальных сборках для широкого спектра задач. Планка покроет все потребности.  В набор QUMO [QUM4U-8G2400P16] 8 ГБ входит один элемент. Объем памяти модуля составляет 8 ГБ. Этого достаточно для ряда устройств. Но можно совместить планку с элементами со схожими характеристиками.  Форм-фактор модуля – DIMM. Он используется для различных стационарных систем. Учитывайте и тип памяти – DDR4. Установка происходит на совместимые материнские платы, важно учесть и поддержку процессором подобных элементов. Монтаж планки займет пару минут у владельца, она легко вставляется в слот.  Тактовая частота – 2400 МГц. Пропускная способность модуля – PC19200. Удается обеспечить быстрый обмен информацией и исключить возникновение проблем при использовании. Можно полноценно работать с различными приложениями, оперативно переключаться между ними.  Высота планки составляет 31,25 мм. Она получает питание от материнской платы. Подаваемое напряжение на модуль – 1.2 В.",
   "Цена": "4697 ₽"
}