{
   "Общие параметры": {
      " Тип ": "оперативная память",
      " Модель ": " AMD Radeon R5 Entertainment Series",
      " Код производителя ": " [R538G1601U2SL-U]"
   },
   "Объем и состав комплекта": {
      " Тип памяти ": "DDR3L",
      " Форм-фактор памяти ": "DIMM",
      " Суммарный объем памяти всего комплекта ": " 8 ГБ",
      " Объем одного модуля памяти ": " 8 ГБ",
      " Количество модулей в комплекте ": " 1",
      " Регистровая память ": " нет",
      " ECC-память ": " нет"
   },
   "Быстродействие": {
      " Тактовая частота ": " 1600 МГц",
      " Профили Intel XMP ": " нет"
   },
   "Тайминги": {
      " CAS Latency (CL) ": " 11",
      " RAS to CAS Delay (tRCD) ": " 11",
      " Row Precharge Delay (tRP) ": " 11",
      " Activate to Precharge Delay (tRAS) ": " 28"
   },
   "Конструкция": {
      " Наличие радиатора ": " нет",
      " Подсветка элементов платы ": " нет",
      " Высота ": " 30 мм",
      " Низкопрофильная (Low Profile) ": " нет"
   },
   "Дополнительно": {
      " Напряжение питания ": " 1.35 В"
   },
   "Описание": "Оперативная память AMD Radeon R5 Entertainment Series [R538G1601U2SL-U] – быстрое и удобное средство, чтобы ускорить производительность такого родного и привычного для вас компьютера. От вас потребуется только установить AMD Radeon R5 Entertainment Series [R538G1601U2SL-U] в нужный разъем и вы сразу же сможете наслаждаться тем, насколько быстр и «прокачан» стал ваш компьютер. Ведь данная оперативная память типа DDR3L сделает ваш компьютер на 8 Гб быстрее и мощнее. Благодаря пропускной способности PC12800 и тактовой частоте 1600 МГц, которая может варьироваться в зависимости от требуемых режимов работы в диапазоне от 800 МГц до 1600 МГц, вы сможете сразу же почувствовать увеличившееся быстродействие всей системы. Для питания этой карте требуется напряжение всего в 1.35 В, а высота этой карты памяти 30 миллиметров.",
   "Цена": "3313 ₽"
}