{
   "Общие параметры": {
      " Тип ": "оперативная память",
      " Модель ": " QUMO",
      " Код производителя ": " [QUM3U-4G1600С11]"
   },
   "Объем и состав комплекта": {
      " Тип памяти ": "DDR3",
      " Форм-фактор памяти ": "DIMM",
      " Суммарный объем памяти всего комплекта ": " 4 ГБ",
      " Объем одного модуля памяти ": " 4 ГБ",
      " Количество модулей в комплекте ": " 1",
      " Регистровая память ": " нет",
      " ECC-память ": " нет"
   },
   "Быстродействие": {
      " Тактовая частота ": " 1600 МГц",
      " Профили Intel XMP ": " нет"
   },
   "Тайминги": {
      " CAS Latency (CL) ": " 11",
      " RAS to CAS Delay (tRCD) ": " 11",
      " Row Precharge Delay (tRP) ": " 11"
   },
   "Конструкция": {
      " Наличие радиатора ": " нет",
      " Подсветка элементов платы ": " нет",
      " Высота ": " 30 мм",
      " Низкопрофильная (Low Profile) ": " нет"
   },
   "Дополнительно": {
      " Напряжение питания ": " 1.5 В"
   },
   "Описание": "Оперативная память Qumo [QUM3U-4G1600С11] 4 ГБ разработана для использования в компьютере. Вы сможете заменить старую планку или расширить объем ОЗУ в устройстве. Модуль изготовлен из качественных компонентов и прослужит в течение длительного периода.  Оперативная память Qumo [QUM3U-4G1600С11] 4 ГБ выпускается в формате DIMM. Этот стандарт используется для стационарных ПК. Тип памяти – DDR3. Учитывайте данный параметр при определении совместимости с материнской платой и другими компонентами компьютера.  Объем оперативной памяти – 4 ГБ. Этого хватит для ряда устройств, можно комфортно работать с компьютером. Допускается установка модуля вместе с другими планками. Но при определении совместимости необходимо учитывать характеристики плашек.  Тактовая частота – 1600 МГц. Обеспечивается высокая пропускная способность и быстрый обмен информацией. Модуль получает питание от материнской платы, подаваемое напряжение – 1.5 В.  Планка легко подключается к системе. Она устанавливается в специальный слот на материнской плате. Вы сможете справиться самостоятельно с этой задачей и продолжить пользоваться компьютером.",
   "Цена": "5833 ₽"
}