{
   "Общие параметры": {
      " Тип ": "оперативная память",
      " Модель ": " AMD Radeon R7 Performance Series",
      " Код производителя ": " [R7S48G2606U2S]"
   },
   "Объем и состав комплекта": {
      " Тип памяти ": "DDR4",
      " Форм-фактор памяти ": "DIMM",
      " Суммарный объем памяти всего комплекта ": " 8 ГБ",
      " Объем одного модуля памяти ": " 8 ГБ",
      " Количество модулей в комплекте ": " 1",
      " Регистровая память ": " нет",
      " ECC-память ": " нет"
   },
   "Быстродействие": {
      " Тактовая частота ": " 2666 МГц"
   },
   "Тайминги": {
      " CAS Latency (CL) ": " 16",
      " RAS to CAS Delay (tRCD) ": " 18",
      " Row Precharge Delay (tRP) ": " 18",
      " Activate to Precharge Delay (tRAS) ": " 35"
   },
   "Конструкция": {
      " Наличие радиатора ": " есть",
      " Подсветка элементов платы ": " нет",
      " Низкопрофильная (Low Profile) ": " нет"
   },
   "Дополнительно": {
      " Напряжение питания ": " 1.2 В"
   },
   "Описание": "Оперативная память AMD Radeon R7 Performance Series [R7S48G2606U2S], являющаяся продуктом всемирно известной корпорации AMD, порадует вас не только быстродействием, но и исключительной надежностью. Модуль, объем которого равен 8 ГБ, предназначен для комплектации игровых системных блоков. Проведя модернизацию памяти, вы наверняка почувствуете прирост производительности. Устройство соответствует типу DDR4, обладая, таким образом, совместимостью с подавляющим большинством эксплуатируемых в настоящее время материнских плат.  Оперативная память AMD Radeon R7 Performance Series [R7S48G2606U2S] использует тактовую частоту 2666 МГц. Допускается возможность использования и других частот, наименьшей из которых является частота 1600 МГц. Пропускная способность памяти равна 21300 МГц. Модуль соответствует таймингам 16-18-18-35. Напряжение питания памяти стандартно для DDR4 – 1.2 В. Важным элементом конструкции модуля является радиатор, обеспечивающий нужный температурный режим. Память упакована в компактную коробку из прозрачного пластика.",
   "Цена": "4184 ₽"
}